{
  "$schema": "https://json-schema.org/draft/2020-12/schema",
  "$id": "https://local.invalid/mybatis-sql-review/sql-summary.schema.json",
  "title": "MyBatis SQL review summary",
  "type": "object",
  "additionalProperties": false,
  "required": [
    "schema_version",
    "statement_key",
    "mapper_relative_path",
    "namespace",
    "statement_id",
    "status",
    "command_type",
    "select_key",
    "risk_level",
    "scenario_count",
    "data_source",
    "catalog",
    "schema",
    "project",
    "scope",
    "evidence_file",
    "report_file",
    "findings"
  ],
  "properties": {
    "schema_version": {
      "type": "string",
      "enum": ["mybatis-sql-review-summary/v1"]
    },
    "statement_key": {
      "type": "string",
      "minLength": 1
    },
    "mapper_relative_path": {
      "type": "string",
      "minLength": 1
    },
    "namespace": {
      "type": "string",
      "minLength": 1
    },
    "statement_id": {
      "type": "string",
      "minLength": 1
    },
    "status": {
      "type": "string",
      "enum": ["reviewed", "no-findings"]
    },
    "command_type": {
      "type": "string",
      "enum": ["select", "insert", "update", "delete", "selectKey"]
    },
    "select_key": {
      "type": "boolean"
    },
    "risk_level": {
      "type": "string",
      "enum": ["none", "low", "medium", "high", "critical"]
    },
    "scenario_count": {
      "type": "integer",
      "minimum": 0,
      "maximum": 3
    },
    "data_source": {"type": "string", "minLength": 1},
    "catalog": {"type": "string", "minLength": 1},
    "schema": {"type": "string", "minLength": 1},
    "project": {"type": "string", "minLength": 1},
    "scope": {"type": "string", "enum": ["GLOBAL", "PROJECT", "ALL"]},
    "evidence_file": {
      "type": "string",
      "enum": ["database-evidence.json"]
    },
    "report_file": {
      "type": "string",
      "enum": ["report.md"]
    },
    "findings": {
      "type": "array",
      "items": {
        "type": "object",
        "additionalProperties": false,
        "required": [
          "id",
          "severity",
          "category",
          "title",
          "description",
          "evidence_ids",
          "recommendation"
        ],
        "properties": {
          "id": {"type": "string", "minLength": 1},
          "severity": {
            "type": "string",
            "enum": ["info", "low", "medium", "high", "critical"]
          },
          "category": {"type": "string", "minLength": 1},
          "title": {"type": "string", "minLength": 1},
          "description": {"type": "string", "minLength": 1},
          "evidence_ids": {
            "type": "array",
            "minItems": 1,
            "uniqueItems": true,
            "items": {"type": "string", "minLength": 1}
          },
          "recommendation": {"type": "string", "minLength": 1}
        }
      }
    }
  }
}
