{
  "schema_version": "mybatis-sql-review-summary/v1",
  "statement_key": "com-spdb-upfs-db-codex-review-probe-mapper-insert-company-9f7f553cf938",
  "mapper_relative_path": "src/test/resources/mapper/CodexReviewProbeMapper.xml",
  "namespace": "com.spdb.upfs.db.CodexReviewProbeMapper",
  "statement_id": "insertCompany",
  "status": "reviewed",
  "command_type": "insert",
  "select_key": false,
  "risk_level": "low",
  "scenario_count": 0,
  "data_source": "deepseek@localhost",
  "catalog": "deepseek",
  "schema": "deepseek",
  "project": "/Users/wangyufeng/IdeaProjects/uasp-qz-json",
  "scope": "ALL",
  "evidence_file": "database-evidence.json",
  "report_file": "report.md",
  "findings": [
    {
      "id": "F1",
      "severity": "low",
      "category": "portability",
      "title": "Generated-key retrieval depends on driver support",
      "description": "useGeneratedKeys=true with keyProperty=\"id\" and keyColumn=\"ID\" relies on the JDBC driver returning generated keys. On databases or drivers without identity/generated-key support, or where column ID is not an auto-increment identity, the id will not be populated. This is a static observation; runtime confirmation is required.",
      "evidence_ids": [],
      "recommendation": "Confirm COMPANY.ID is an auto-increment/identity column and that the target JDBC driver supports getGeneratedKeys; otherwise read the id via a post-insert SELECT or an explicit <selectKey>."
    },
    {
      "id": "F2",
      "severity": "low",
      "category": "maintainability",
      "title": "Unchecked java.util.Map parameter contract",
      "description": "parameterType=java.util.Map with five #{...} placeholders gives no compile-time safety; a missing key throws a BindingException at runtime and a null value may violate NOT NULL constraints. Static observation only; DB constraints are unverified.",
      "evidence_ids": [],
      "recommendation": "Prefer a typed parameter object or @Param-annotated method arguments, and validate required fields before insert."
    },
    {
      "id": "F3",
      "severity": "info",
      "category": "portability",
      "title": "Uppercase identifiers depend on catalog identifier folding",
      "description": "Column names are written in uppercase without quoting. On databases that fold unquoted identifiers to lowercase, the DDL identifiers must match. Unverified against the configured catalog.",
      "evidence_ids": [],
      "recommendation": "Verify the actual COMPANY column definitions in the target catalog and align identifier casing or quote them consistently."
    },
    {
      "id": "F4",
      "severity": "info",
      "category": "maintainability",
      "title": "No dynamic SQL branches",
      "description": "The statement contains no dynamic nodes and is not injection-prone. Nothing further to review statically.",
      "evidence_ids": [],
      "recommendation": "No action required."
    }
  ]
}
