{
  "schema_version" : "mybatis-sql-review-summary/v1",
  "statement_key" : "com-spdb-upfs-db-codex-review-probe-mapper-delete-company-by-id-and-state-b01871f17412",
  "mapper_relative_path" : "src/test/resources/mapper/CodexReviewProbeMapper.xml",
  "namespace" : "com.spdb.upfs.db.CodexReviewProbeMapper",
  "statement_id" : "deleteCompanyByIdAndState",
  "status" : "reviewed",
  "command_type" : "delete",
  "select_key" : false,
  "risk_level" : "low",
  "scenario_count" : 0,
  "data_source" : "deepseek@localhost",
  "catalog" : "deepseek",
  "schema" : "deepseek",
  "project" : "/Users/wangyufeng/IdeaProjects/uasp-qz-json",
  "scope" : "ALL",
  "evidence_file" : "database-evidence.json",
  "report_file" : "report.md",
  "findings" : [ {
    "id" : "F-1",
    "severity" : "low",
    "category" : "data-safety",
    "title" : "Irreversible hard DELETE without audit or soft-delete safeguard",
    "description" : "deleteCompanyByIdAndState permanently removes rows from COMPANY. Deleted rows are unrecoverable through the mapper because the statement writes no audit record, tombstone, or soft-delete column. The intended business semantics (hard vs soft delete) are unverified; this is a confirmed static observation with no runtime evidence.",
    "evidence_ids" : [ ],
    "recommendation" : "Confirm that an irreversible hard delete is the intended behavior. If retention or compliance is required, replace the DELETE with a soft-delete UPDATE (state/valid-to column) or log the affected identifiers inside the enclosing transaction before deleting."
  }, {
    "id" : "F-2",
    "severity" : "info",
    "category" : "correctness",
    "title" : "Predicate assumes ID uniquely identifies a single target row",
    "description" : "The WHERE clause filters only on ID and COMPANY_STATE. If COMPANY.ID is not unique, a single call can delete multiple rows. ID uniqueness and the delete selectivity of COMPANY_STATE could not be verified against the database because this statement is static-review-only.",
    "evidence_ids" : [ ],
    "recommendation" : "Verify COMPANY.ID is a unique or primary-key column. If multi-row deletes are possible, add safeguards such as a pre-delete row-count check in the transaction or DELETE ... LIMIT where supported."
  } ]
}