{
  "schema_version": "mybatis-sql-review-summary/v1",
  "statement_key": "com-spdb-upfs-db-codex-review-probe-mapper-delete-company-by-id-and-state-b01871f17412",
  "mapper_relative_path": "src/test/resources/mapper/CodexReviewProbeMapper.xml",
  "namespace": "com.spdb.upfs.db.CodexReviewProbeMapper",
  "statement_id": "deleteCompanyByIdAndState",
  "status": "reviewed",
  "command_type": "delete",
  "select_key": false,
  "risk_level": "low",
  "scenario_count": 0,
  "data_source": "deepseek@localhost",
  "catalog": "deepseek",
  "schema": "deepseek",
  "project": "/Users/wangyufeng/IdeaProjects/uasp-qz-json",
  "scope": "ALL",
  "evidence_file": "database-evidence.json",
  "report_file": "report.md",
  "findings": [
    {
      "id": "F-001",
      "severity": "low",
      "category": "concurrency/correctness",
      "title": "Affected-row contract is not visible in the mapper",
      "description": "The DELETE includes COMPANY_STATE as a state guard, but static mapper XML cannot show whether a zero affected-row result is handled as an expected stale-state or missing-row outcome.",
      "evidence_ids": ["static-xml-001"],
      "recommendation": "Verify the caller checks the affected-row count and documents the intended zero-row outcome."
    },
    {
      "id": "F-002",
      "severity": "info",
      "category": "performance",
      "title": "Schema and index support remain unverified",
      "description": "The allowed table-schema metadata request was rejected; uniqueness and index coverage for the ID and COMPANY_STATE predicate are not confirmed.",
      "evidence_ids": ["db-meta-001"],
      "recommendation": "In an approved subsequent run, inspect COMPANY schema and indexes with the bounded Database MCP metadata tool."
    }
  ]
}