{
  "schema_version": "mybatis-sql-review-summary/v1",
  "statement_key": "com-spdb-upfs-db-codex-review-probe-mapper-delete-company-by-id-and-state-b01871f17412",
  "mapper_relative_path": "src/test/resources/mapper/CodexReviewProbeMapper.xml",
  "namespace": "com.spdb.upfs.db.CodexReviewProbeMapper",
  "statement_id": "deleteCompanyByIdAndState",
  "status": "reviewed",
  "command_type": "delete",
  "select_key": false,
  "risk_level": "low",
  "scenario_count": 0,
  "data_source": "deepseek@localhost",
  "catalog": "deepseek",
  "schema": "deepseek",
  "project": "/Users/wangyufeng/IdeaProjects/uasp-qz-json",
  "scope": "ALL",
  "evidence_file": "database-evidence.json",
  "report_file": "report.md",
  "findings": [
    {
      "id": "F-01",
      "severity": "low",
      "category": "data-integrity",
      "title": "Hard DELETE relies solely on caller-supplied state guard",
      "description": "The DELETE targets rows by PRIMARY key ID plus a COMPANY_STATE equality. Metadata confirms ID is a unique PRIMARY index, bounding the delete to one row; the only protection against deleting a record in an unintended state is the caller-provided COMPANY_STATE value. The mapper exposes no LIMIT or affected-row assertion.",
      "evidence_ids": [
        "cmcp_db_database_list_table_schema"
      ],
      "recommendation": "Check the affected-row count in the service layer and fail on unexpected (0 or >1) results."
    },
    {
      "id": "F-02",
      "severity": "info",
      "category": "correctness",
      "title": "Null COMPANY_STATE silently deletes nothing",
      "description": "COMPANY_STATE is nullable in the schema. A null parameter binds as COMPANY_STATE = NULL, which never matches, silently deleting zero rows instead of surfacing an error.",
      "evidence_ids": [
        "cmcp_db_database_list_table_schema"
      ],
      "recommendation": "Validate companyState as non-null in the service layer before invoking this mapper."
    },
    {
      "id": "F-03",
      "severity": "info",
      "category": "maintainability",
      "title": "Weakly typed Map parameter",
      "description": "parameterType=java.util.Map provides no compile-time safety; a typo in a map key fails only at runtime.",
      "evidence_ids": [
        "cmcp_db_database_list_table_schema"
      ],
      "recommendation": "Replace the Map with a typed parameter object or @Param method arguments."
    }
  ]
}
