{
  "schema_version" : "mybatis-sql-review-summary/v1",
  "statement_key" : "com-spdb-upfs-db-codex-review-probe-mapper-delete-company-by-id-and-state-b01871f17412",
  "mapper_relative_path" : "src/test/resources/mapper/CodexReviewProbeMapper.xml",
  "namespace" : "com.spdb.upfs.db.CodexReviewProbeMapper",
  "statement_id" : "deleteCompanyByIdAndState",
  "status" : "reviewed",
  "command_type" : "delete",
  "select_key" : false,
  "risk_level" : "low",
  "scenario_count" : 0,
  "data_source" : "deepseek@localhost",
  "catalog" : "deepseek",
  "schema" : "deepseek",
  "project" : "/Users/wangyufeng/IdeaProjects/uasp-qz-json",
  "scope" : "ALL",
  "evidence_file" : "database-evidence.json",
  "report_file" : "report.md",
  "findings" : [ {
    "id" : "F-01",
    "severity" : "low",
    "category" : "concurrency",
    "title" : "No optimistic-locking guard on delete",
    "description" : "deleteCompanyByIdAndState deletes on ID and COMPANY_STATE only; a stale caller can remove a row that changed after it was read. Confirmed statically from the mapper source; the surrounding application's concurrency behavior is unverified.",
    "evidence_ids" : [ ],
    "recommendation" : "Add a version or last-updated-timestamp predicate to the WHERE clause if concurrent modification of COMPANY rows is possible."
  }, {
    "id" : "F-02",
    "severity" : "info",
    "category" : "data-integrity",
    "title" : "Affected-row count not enforced",
    "description" : "The mapper returns the native affected-row count but the statement cannot guarantee exactly one row was deleted.",
    "evidence_ids" : [ ],
    "recommendation" : "Have the caller verify the returned affected-row count equals 1 and treat any other value as a failure."
  } ]
}