{
  "schema_version" : "mybatis-sql-review-summary/v1",
  "statement_key" : "com-spdb-upfs-db-codex-review-probe-mapper-insert-company-9f7f553cf938",
  "mapper_relative_path" : "src/test/resources/mapper/CodexReviewProbeMapper.xml",
  "namespace" : "com.spdb.upfs.db.CodexReviewProbeMapper",
  "statement_id" : "insertCompany",
  "status" : "reviewed",
  "command_type" : "insert",
  "select_key" : false,
  "risk_level" : "low",
  "scenario_count" : 0,
  "data_source" : "deepseek@localhost",
  "catalog" : "deepseek",
  "schema" : "deepseek",
  "project" : "/Users/wangyufeng/IdeaProjects/uasp-qz-json",
  "scope" : "ALL",
  "evidence_file" : "database-evidence.json",
  "report_file" : "report.md",
  "findings" : [ {
    "id" : "F1",
    "severity" : "info",
    "category" : "database-metadata",
    "title" : "COMPANY table constraints not verified",
    "description" : "The nullability, type, default, and constraint behavior of the five target columns (COMPANY_NAME, COMPANY_STATE, COMPANY_CITY, EMPLOYEE, COMPANY_CREATE_YEAR) was not confirmed because this static-review-only insert statement made no Database MCP call.",
    "evidence_ids" : [ ],
    "recommendation" : "Confirm the COMPANY DDL (NOT NULL, defaults, unique constraints, column types) matches the five bound parameters before production use."
  }, {
    "id" : "F2",
    "severity" : "low",
    "category" : "data-integrity",
    "title" : "NULL binding for non-nullable columns possible",
    "description" : "With parameterType=java.util.Map, an absent key binds NULL; if any of the five target columns is NOT NULL, the insert fails at runtime. Unverified against schema.",
    "evidence_ids" : [ ],
    "recommendation" : "Add explicit presence checks for the required map keys (companyName, companyState, companyCity, employee, companyCreateYear) before invoking the mapper."
  }, {
    "id" : "F3",
    "severity" : "info",
    "category" : "generated-keys",
    "title" : "Generated-key retrieval depends on driver support",
    "description" : "useGeneratedKeys=true with keyProperty=id and keyColumn=ID relies on the JDBC driver and engine supporting getGeneratedKeys; this behavior is unverified for the target environment.",
    "evidence_ids" : [ ],
    "recommendation" : "Verify driver support for the target engine; if unreliable, use an explicit RETURNING/OUTPUT strategy and bind the generated id directly."
  } ]
}