{
  "schema_version": "mybatis-sql-review-summary/v1",
  "statement_key": "com-spdb-upfs-db-codex-review-probe-mapper-delete-company-by-id-and-state-b01871f17412",
  "mapper_relative_path": "src/test/resources/mapper/CodexReviewProbeMapper.xml",
  "namespace": "com.spdb.upfs.db.CodexReviewProbeMapper",
  "statement_id": "deleteCompanyByIdAndState",
  "status": "reviewed",
  "command_type": "delete",
  "select_key": false,
  "risk_level": "low",
  "scenario_count": 0,
  "data_source": "deepseek@localhost",
  "catalog": "deepseek",
  "schema": "deepseek",
  "project": "/Users/wangyufeng/IdeaProjects/uasp-qz-json",
  "scope": "ALL",
  "evidence_file": "database-evidence.json",
  "report_file": "report.md",
  "findings": [
    {
      "id": "F-001",
      "severity": "info",
      "category": "metadata",
      "title": "Target table and columns confirmed",
      "description": "Data source deepseek@localhost (MySQL 9.2.0, jdbc:mysql://localhost:3306/deepseek) is configured; catalog deepseek exists; the COMPANY table exists with 6 columns including ID (INT, NOT NULL) and COMPANY_STATE (VARCHAR 255, nullable).",
      "evidence_ids": [
        "meta-datasources",
        "meta-databases",
        "meta-company-schema"
      ],
      "recommendation": "None required; the mapped table and both referenced columns resolve in the target catalog."
    },
    {
      "id": "F-002",
      "severity": "low",
      "category": "null-handling",
      "title": "Null companyState silently matches nothing",
      "description": "COMPANY_STATE is nullable in the schema; a null companyState parameter yields WHERE COMPANY_STATE = NULL, which matches no rows per SQL three-valued logic, so the delete silently no-ops.",
      "evidence_ids": [
        "meta-company-schema"
      ],
      "recommendation": "Pass a non-null companyState from callers, or validate the parameter before invocation."
    },
    {
      "id": "F-003",
      "severity": "info",
      "category": "index",
      "title": "Primary index resolves the ID predicate",
      "description": "COMPANY has a PRIMARY unique index on ID, so the equality predicate on ID is index-resolved and the delete is row-targeted.",
      "evidence_ids": [
        "meta-company-schema-columns"
      ],
      "recommendation": "None required; keep the ID + state two-predicate form."
    }
  ]
}
