{
  "schema_version" : "mybatis-sql-review-summary/v1",
  "statement_key" : "com-spdb-upfs-db-codex-review-probe-mapper-find-company-by-id-51337711cfa2",
  "mapper_relative_path" : "src/test/resources/mapper/CodexReviewProbeMapper.xml",
  "namespace" : "com.spdb.upfs.db.CodexReviewProbeMapper",
  "statement_id" : "findCompanyById",
  "status" : "reviewed",
  "command_type" : "select",
  "select_key" : false,
  "risk_level" : "low",
  "scenario_count" : 0,
  "data_source" : "deepseek@localhost",
  "catalog" : "deepseek",
  "schema" : "deepseek",
  "project" : "/Users/wangyufeng/IdeaProjects/uasp-qz-json",
  "scope" : "ALL",
  "evidence_file" : "database-evidence.json",
  "report_file" : "report.md",
  "findings" : [ {
    "id" : "FIND-1",
    "severity" : "info",
    "category" : "static-review",
    "title" : "Include fragment and resultMap definitions not visible in candidate source",
    "description" : "The statement references <include refid=\"CompanyColumns\"/> and resultMap=\"CompanyResultMap\", but neither is defined in the reviewed raw XML; column selection and mapping are unverified statically. The parameterized WHERE ID = #{id,jdbcType=INTEGER} predicate itself shows no correctness, performance, or safety issue.",
    "evidence_ids" : [ ],
    "recommendation" : "Confirm CompanyColumns and CompanyResultMap resolve to definitions in the mapper and match the COMPANY table columns; no code change is required if they resolve."
  } ]
}