{
  "schema_version": "mybatis-sql-review-summary/v1",
  "statement_key": "com-spdb-upfs-db-codex-review-probe-mapper-delete-company-by-id-and-state-b01871f17412",
  "mapper_relative_path": "src/test/resources/mapper/CodexReviewProbeMapper.xml",
  "namespace": "com.spdb.upfs.db.CodexReviewProbeMapper",
  "statement_id": "deleteCompanyByIdAndState",
  "status": "reviewed",
  "command_type": "delete",
  "select_key": false,
  "risk_level": "low",
  "scenario_count": 0,
  "data_source": "deepseek@localhost",
  "catalog": "deepseek",
  "schema": "deepseek",
  "project": "/Users/wangyufeng/IdeaProjects/uasp-qz-json",
  "scope": "ALL",
  "evidence_file": "database-evidence.json",
  "report_file": "report.md",
  "findings": [
    {
      "id": "F-001",
      "severity": "low",
      "category": "concurrency/correctness",
      "title": "Conditional delete outcome requires affected-row handling",
      "description": "The source predicate requires both ID and COMPANY_STATE, but schema, transaction, and caller treatment of zero affected rows are unverified because metadata calls were rejected.",
      "evidence_ids": [
        "static-source-001",
        "db-meta-003"
      ],
      "recommendation": "Treat a zero affected-row result explicitly and map a state mismatch to the intended business or concurrency outcome."
    },
    {
      "id": "F-002",
      "severity": "info",
      "category": "performance",
      "title": "Predicate index support is unverified",
      "description": "The mapper filters by ID and COMPANY_STATE, while COMPANY columns and indexes could not be retrieved.",
      "evidence_ids": [
        "static-source-001",
        "db-meta-003"
      ],
      "recommendation": "Use approved schema metadata to verify the intended uniqueness and index support for the predicate."
    }
  ]
}
