{
  "schema_version" : "mybatis-sql-review-summary/v1",
  "statement_key" : "com-spdb-upfs-db-codex-review-probe-mapper-update-company-profile-6f27385cd921",
  "mapper_relative_path" : "src/test/resources/mapper/CodexReviewProbeMapper.xml",
  "namespace" : "com.spdb.upfs.db.CodexReviewProbeMapper",
  "statement_id" : "updateCompanyProfile",
  "status" : "reviewed",
  "command_type" : "update",
  "select_key" : false,
  "risk_level" : "medium",
  "scenario_count" : 0,
  "data_source" : "deepseek@localhost",
  "catalog" : "deepseek",
  "schema" : "deepseek",
  "project" : "/Users/wangyufeng/IdeaProjects/uasp-qz-json",
  "scope" : "ALL",
  "evidence_file" : "database-evidence.json",
  "report_file" : "report.md",
  "findings" : [ {
    "id" : "F-1",
    "severity" : "medium",
    "category" : "dynamic-sql",
    "title" : "Empty SET clause when all conditional columns are null",
    "description" : "When every <if> test evaluates false, the <set> element contributes no assignments and MyBatis trims the SET keyword, producing the invalid SQL `UPDATE COMPANY WHERE ID = ?`, which fails at runtime with a syntax error. Static observation; unverified without runtime execution.",
    "evidence_ids" : [ ],
    "recommendation" : "Guard the update so the SET clause is never empty: validate in the service layer that at least one attribute is present, or assert a minimum non-null <if> assignment before building the statement."
  }, {
    "id" : "F-2",
    "severity" : "low",
    "category" : "concurrency",
    "title" : "No optimistic locking or audit timestamp",
    "description" : "The WHERE clause carries only the primary key and no version guard, and no updated_at column is maintained, so concurrent writers can silently overwrite each other (last-write-wins). Static observation; unverified.",
    "evidence_ids" : [ ],
    "recommendation" : "Add a version (or updated_at) column, include it in the WHERE clause for optimistic concurrency control, and maintain an audit timestamp within the SET clause."
  }, {
    "id" : "F-3",
    "severity" : "low",
    "category" : "type-handling",
    "title" : "Untyped Map values for INTEGER columns",
    "description" : "employee and companyCreateYear are declared jdbcType=INTEGER but are sourced from a java.util.Map; non-numeric caller values trigger type-handler conversion errors at runtime. Static observation; unverified.",
    "evidence_ids" : [ ],
    "recommendation" : "Coerce and validate employee and companyCreateYear to numeric types in the caller before invoking the mapper."
  }, {
    "id" : "F-4",
    "severity" : "info",
    "category" : "null-handling",
    "title" : "Null id silently matches zero rows",
    "description" : "WHERE ID = #{id} with a null id evaluates to ID = NULL, which matches no rows and returns success with zero affected rows. Static observation; unverified.",
    "evidence_ids" : [ ],
    "recommendation" : "Validate that id is non-null before executing the update and treat a zero-row result as an explicit error where appropriate."
  } ]
}